{
  "task_id": "AIOS2-BATCH30-2026-08-30",
  "owner": "arena-ai-coding-agent",
  "branch": "batch/30-test-hygiene-uasep-3.5",
  "write_set": [
    "runtime/paths.py",
    "runtime/",
    "tests/conftest.py",
    "tests/test_recovery_concurrency_e2e.py",
    "tests/uasep/",
    ".uasep/",
    ".github/workflows/ci.yml"
  ],
  "claim_time": "2026-08-30 UTC",
  "expected_completion": "Same session: merged after green CI",
  "status": "ACTIVE",
  "last_refresh": "2026-08-30 UTC",
  "transfer_to": null,
  "release_reason": null
}
