{
  "task_id": "AIOS2-RUNTIME-002-2026-08-30",
  "owner": "arena-ai-coding-agent",
  "branch": "main (sequential PR merges)",
  "write_set": [
    "runtime/",
    "tests/",
    "docs/",
    ".github/workflows/",
    ".uasep/",
    ".gitignore"
  ],
  "claim_time": "2026-08-30 UTC",
  "expected_completion": "Same session: all queue PRs merged or dispositioned",
  "status": "ACTIVE",
  "last_refresh": "2026-08-30 UTC",
  "transfer_to": null,
  "release_reason": null
}
